{
  "record_id": "b50ef2940b8e8a3c377c26423df1710466d2d1a8",
  "vin": "1XPBSYN00N1000101",
  "as_of": "2026-08-24T12:00:00+00:00",
  "chassis": {
    "model": "579",
    "class": "Class 8",
    "series": [
      "Diesel",
      "MX-Equipped"
    ],
    "in_service_date": "2023-04-12",
    "vocational_use": "Line Haul"
  },
  "usage": {
    "odometer_km": 412000,
    "engine_hours": 4800,
    "as_of": "2026-08-24T12:00:00+00:00",
    "source": "SmartLINQ"
  },
  "owner": {
    "customer_id": "CDK-CUST-000101",
    "customer_type": "Small Fleet",
    "fleet_id": null,
    "home_rooftop": "PA-MONCTON"
  },
  "coverage": {
    "base_emissions_carb": {
      "applies": true,
      "months_remaining": 20,
      "distance_remaining_km": null,
      "hours_remaining": null,
      "expiry_reason": "months"
    },
    "base_emissions_epa_eccc": {
      "applies": true,
      "months_remaining": 20,
      "distance_remaining_km": 0,
      "hours_remaining": null,
      "expiry_reason": "distance"
    },
    "standard_vehicle": {
      "applies": true,
      "months_remaining": 0,
      "distance_remaining_km": 0,
      "hours_remaining": null,
      "expiry_reason": "months"
    },
    "standard_mx_engine": {
      "applies": true,
      "months_remaining": 0,
      "distance_remaining_km": 0,
      "hours_remaining": 1450,
      "expiry_reason": "months"
    },
    "engine_major_components": {
      "applies": true,
      "months_remaining": 20,
      "distance_remaining_km": 388000,
      "hours_remaining": 7700,
      "expiry_reason": "months"
    },
    "vehicle_major_components": {
      "applies": true,
      "months_remaining": 0,
      "distance_remaining_km": 68000,
      "hours_remaining": null,
      "expiry_reason": "months"
    },
    "severe_service": {
      "applies": true,
      "months_remaining": 0,
      "distance_remaining_km": 0,
      "hours_remaining": null,
      "expiry_reason": "months"
    },
    "paccar_alternator_starter": {
      "applies": true,
      "months_remaining": 0,
      "distance_remaining_km": 148000,
      "hours_remaining": null,
      "expiry_reason": "months"
    },
    "paccar_front_axles": {
      "applies": true,
      "months_remaining": 20,
      "distance_remaining_km": 788000,
      "hours_remaining": null,
      "expiry_reason": "months"
    },
    "non_paccar_front_axles": {
      "applies": true,
      "months_remaining": 0,
      "distance_remaining_km": 68000,
      "hours_remaining": null,
      "expiry_reason": "months"
    }
  },
  "open_jobs": [
    {
      "job_id": "E312-2025",
      "authority": "Field Repair Campaign",
      "type": "Aftertreatment",
      "component": "Diesel Exhaust Fluid (DEF) Dosing Valve [Injector]",
      "ata_code": "SPN-4334",
      "coverage_bucket": "base_emissions_epa_eccc",
      "estimated_srt_hours": 1.6,
      "parts_on_hand": true,
      "customer_pay_at_risk_cad": 1450.0,
      "status": "Open",
      "source_bulletin_url": "https://paccar.example/bulletins/E312-2025"
    },
    {
      "job_id": "PROG-EGR-COOLER-018",
      "authority": "Prognostic",
      "type": "Powertrain",
      "component": "EGR Cooler Coolant Return Tube O-Ring Seals",
      "ata_code": null,
      "coverage_bucket": "standard_mx_engine",
      "estimated_srt_hours": 3.2,
      "parts_on_hand": false,
      "customer_pay_at_risk_cad": 2180.0,
      "status": "Open",
      "source_bulletin_url": "https://paccar.example/prognostics/EGR-018"
    }
  ],
  "score": {
    "margin_estimate_cad": 1387.01,
    "time_to_expiry_days": 0,
    "booking_urgency": "inbound-tonight",
    "total": 56.9
  },
  "compliance": {
    "clean": true,
    "flags": {
      "missing_technician_id": false,
      "rmi_undocumented": false,
      "labor_time_unsupported": false,
      "repeat_ineffective_repair": false,
      "prior_approval_required_and_missing": false
    }
  },
  "telemetry": {
    "last_ping": "2026-08-24T12:00:00+00:00",
    "in_hawkins_region": true,
    "projected_overnight_region": "Hawkins-NB",
    "geofence_confidence": 0.92
  },
  "source_provenance": [
    {
      "source": "SIR",
      "captured_at": "2026-08-24T12:00:00+00:00"
    },
    {
      "source": "SmartLINQ Service Management",
      "captured_at": "2026-08-24T12:00:00+00:00"
    },
    {
      "source": "PACCAR Solutions Telematics",
      "captured_at": "2026-08-24T12:00:00+00:00"
    },
    {
      "source": "Warranty Quick Reference Guide 2025.4",
      "captured_at": "2026-08-24T12:00:00+00:00",
      "note": "Coverage buckets, months, and distance caps."
    },
    {
      "source": "CARB/EPA/ECCC Emission Component Coverage",
      "captured_at": "2026-08-24T12:00:00+00:00",
      "note": "Emissions-family tagging for aftertreatment jobs."
    },
    {
      "source": "Warranty Procedure Manual v2026.7",
      "captured_at": "2026-08-24T12:00:00+00:00",
      "note": "Authority hierarchy, Prior Approval and audit rules."
    }
  ]
}