{
  "record_id": "556cbb23b28ba446cda1b1f0ceb0d584f1fbb560",
  "vin": "1XPBSYN00L1000404",
  "as_of": "2026-08-24T12:00:00+00:00",
  "chassis": {
    "model": "579",
    "class": "Class 8",
    "series": [
      "Diesel",
      "MX-Equipped"
    ],
    "in_service_date": "2021-03-08",
    "vocational_use": "Line Haul"
  },
  "usage": {
    "odometer_km": 705000,
    "engine_hours": 8100,
    "as_of": "2026-08-24T12:00:00+00:00",
    "source": "SmartLINQ"
  },
  "owner": {
    "customer_id": "CDK-CUST-000404",
    "customer_type": "Direct Fleet",
    "fleet_id": "FLEET-DIRECT-088",
    "home_rooftop": "PA-SAINT-JOHN"
  },
  "coverage": {
    "base_emissions_carb": {
      "applies": true,
      "months_remaining": 0,
      "distance_remaining_km": null,
      "hours_remaining": null,
      "expiry_reason": "months"
    },
    "base_emissions_epa_eccc": {
      "applies": true,
      "months_remaining": 0,
      "distance_remaining_km": 0,
      "hours_remaining": null,
      "expiry_reason": "months"
    },
    "standard_vehicle": {
      "applies": true,
      "months_remaining": 0,
      "distance_remaining_km": 0,
      "hours_remaining": null,
      "expiry_reason": "months"
    },
    "standard_mx_engine": {
      "applies": true,
      "months_remaining": 0,
      "distance_remaining_km": 0,
      "hours_remaining": 0,
      "expiry_reason": "months"
    },
    "engine_major_components": {
      "applies": true,
      "months_remaining": 0,
      "distance_remaining_km": 95000,
      "hours_remaining": 4400,
      "expiry_reason": "months"
    },
    "vehicle_major_components": {
      "applies": true,
      "months_remaining": 0,
      "distance_remaining_km": 0,
      "hours_remaining": null,
      "expiry_reason": "months"
    },
    "severe_service": {
      "applies": true,
      "months_remaining": 0,
      "distance_remaining_km": 0,
      "hours_remaining": null,
      "expiry_reason": "months"
    },
    "paccar_alternator_starter": {
      "applies": true,
      "months_remaining": 0,
      "distance_remaining_km": 0,
      "hours_remaining": null,
      "expiry_reason": "months"
    },
    "paccar_front_axles": {
      "applies": true,
      "months_remaining": 0,
      "distance_remaining_km": 495000,
      "hours_remaining": null,
      "expiry_reason": "months"
    },
    "non_paccar_front_axles": {
      "applies": true,
      "months_remaining": 0,
      "distance_remaining_km": 0,
      "hours_remaining": null,
      "expiry_reason": "months"
    }
  },
  "open_jobs": [
    {
      "job_id": "FLT-3251E",
      "authority": "Live Fault Code",
      "type": "Aftertreatment",
      "component": "Diesel Particulate Filter (DPF) Differential Pressure Sensor",
      "ata_code": "3251.E",
      "coverage_bucket": "base_emissions_epa_eccc",
      "estimated_srt_hours": 1.2,
      "parts_on_hand": true,
      "customer_pay_at_risk_cad": 780.0,
      "status": "Open",
      "source_bulletin_url": null
    }
  ],
  "score": {
    "margin_estimate_cad": 322.56,
    "time_to_expiry_days": 0,
    "booking_urgency": "out-of-region",
    "total": 21.6
  },
  "compliance": {
    "clean": false,
    "flags": {
      "missing_technician_id": false,
      "rmi_undocumented": false,
      "labor_time_unsupported": false,
      "repeat_ineffective_repair": true,
      "prior_approval_required_and_missing": false
    }
  },
  "telemetry": {
    "last_ping": "2026-08-24T12:00:00+00:00",
    "in_hawkins_region": false,
    "projected_overnight_region": "Out-of-region",
    "geofence_confidence": 0.88
  },
  "source_provenance": [
    {
      "source": "SIR",
      "captured_at": "2026-08-24T12:00:00+00:00"
    },
    {
      "source": "SmartLINQ Service Management",
      "captured_at": "2026-08-24T12:00:00+00:00"
    },
    {
      "source": "PACCAR Solutions Telematics",
      "captured_at": "2026-08-24T12:00:00+00:00"
    },
    {
      "source": "Warranty Quick Reference Guide 2025.4",
      "captured_at": "2026-08-24T12:00:00+00:00",
      "note": "Coverage buckets, months, and distance caps."
    },
    {
      "source": "CARB/EPA/ECCC Emission Component Coverage",
      "captured_at": "2026-08-24T12:00:00+00:00",
      "note": "Emissions-family tagging for aftertreatment jobs."
    },
    {
      "source": "Warranty Procedure Manual v2026.7",
      "captured_at": "2026-08-24T12:00:00+00:00",
      "note": "Authority hierarchy, Prior Approval and audit rules."
    }
  ]
}